{
  "gravity": [0.0, -24.0, 0.0],
  "show_grid": true,
  "input_map": {
    "move_x": { "negative": "A", "positive": "D" },
    "jump": "Space"
  },
  "camera": { "mode": "follow", "target": "player", "offset": [0.0, 10.0, 14.0] },
  "entry_script": "scripts/director.rhai",
  "entities": [
    {
      "name": "floor",
      "position": [0.0, -0.5, 0.0],
      "body_type": "fixed",
      "shape": "cuboid",
      "half_extents": [20.0, 0.5, 3.0],
      "color": [0.28, 0.3, 0.34],
      "collision_layer": 1
    },
    {
      "name": "cp1",
      "position": [-6.0, 0.5, 0.0],
      "body_type": "fixed",
      "shape": "cuboid",
      "half_extents": [0.8, 0.8, 0.8],
      "trigger": true,
      "tags": ["checkpoint"],
      "color": [0.2, 0.85, 0.4]
    },
    {
      "name": "cp2",
      "position": [0.0, 2.5, 0.0],
      "body_type": "fixed",
      "shape": "cuboid",
      "half_extents": [0.8, 0.8, 0.8],
      "trigger": true,
      "tags": ["checkpoint"],
      "color": [0.2, 0.85, 0.4]
    },
    {
      "name": "goal",
      "position": [8.0, 0.5, 0.0],
      "body_type": "fixed",
      "shape": "cuboid",
      "half_extents": [1.0, 1.0, 1.0],
      "trigger": true,
      "tags": ["goal"],
      "color": [0.95, 0.85, 0.2]
    },
    {
      "name": "pit",
      "position": [3.0, -1.5, 0.0],
      "body_type": "fixed",
      "shape": "cuboid",
      "half_extents": [1.5, 0.2, 1.5],
      "trigger": true,
      "tags": ["hazard"],
      "color": [0.9, 0.15, 0.1],
      "collision_layer": 4
    },
    {
      "name": "player",
      "tags": ["player"],
      "position": [-10.0, 1.0, 0.0],
      "body_type": "kinematic",
      "shape": "sphere",
      "radius": 0.35,
      "color": [0.3, 0.7, 0.95],
      "script": "scripts/player.rhai",
      "collision_layer": 1,
      "collision_mask": 5
    },
    {
      "name": "enemy",
      "tags": ["enemy"],
      "position": [4.0, 1.0, 0.0],
      "body_type": "kinematic",
      "shape": "sphere",
      "radius": 0.3,
      "color": [0.9, 0.2, 0.2],
      "script": "scripts/patrol_enemy.rhai",
      "collision_layer": 1
    }
  ]
}
