{
  "gravity": [0.0, -9.81, 0.0],
  "input_map": {
    "move_x": { "negative": "A", "positive": "D" },
    "jump": "Space"
  },
  "camera": { "mode": "follow", "target": "player", "offset": [0.0, 6.0, 10.0] },
  "entities": [
    {
      "name": "ground",
      "position": [0.0, -0.5, 0.0],
      "body_type": "fixed",
      "shape": "cuboid",
      "half_extents": [12.0, 0.5, 4.0],
      "color": [0.3, 0.32, 0.35],
      "collision_layer": 1
    },
    {
      "name": "player",
      "tags": ["player"],
      "position": [-4.0, 1.0, 0.0],
      "body_type": "kinematic",
      "shape": "sphere",
      "radius": 0.35,
      "color": [0.3, 0.7, 0.95],
      "script": "scripts/player.rhai",
      "collision_layer": 1,
      "collision_mask": 1
    },
    {
      "name": "checkpoint",
      "position": [0.0, 1.0, 0.0],
      "body_type": "fixed",
      "shape": "cuboid",
      "half_extents": [1.0, 1.0, 1.0],
      "trigger": true,
      "color": [0.2, 0.9, 0.4]
    }
  ]
}
