{
  "gravity": [0.0, 0.0, 0.0],
  "show_grid": true,
  "input_map": {
    "move_x": { "negative": "A", "positive": "D" },
    "move_z": { "negative": "S", "positive": "W" },
    "fire": "Space"
  },
  "camera": { "mode": "follow", "target": "player", "offset": [0.0, 12.0, 0.01] },
  "entry_script": "scripts/wave_director.rhai",
  "entities": [
    {
      "name": "arena",
      "position": [0.0, -0.5, 0.0],
      "body_type": "fixed",
      "shape": "cuboid",
      "half_extents": [10.0, 0.5, 10.0],
      "color": [0.22, 0.24, 0.28]
    },
    {
      "name": "player",
      "tags": ["player"],
      "position": [0.0, 0.5, 0.0],
      "body_type": "kinematic",
      "shape": "sphere",
      "radius": 0.35,
      "color": [0.3, 0.75, 0.95],
      "script": "scripts/player.rhai"
    }
  ]
}
