{
  "gravity": [0.0, 0.0, 0.0],
  "entry_script": "scripts/spawner.rhai",
  "camera": { "mode": "orbit", "distance": 14.0 },
  "entities": [
    {
      "name": "origin",
      "position": [0.0, 0.0, 0.0],
      "body_type": "fixed",
      "shape": "sphere",
      "radius": 0.1,
      "color": [0.5, 0.5, 0.5]
    }
  ]
}
